MashupName,desc,APIs,primary_category,all_category,tags
Bandtrace,"Bandtrace aims to be a music encyclopedia that contains everything you ever wanted to know about artists, what they released, what tracks they have written, recorded or produced, who they've been involved with, the latest news, etc.",MusicBrainz @@@ Discogs @@@ LyricWiki @@@ Spotify Echo Nest @@@ fanart.tv Music @@@ iTunes & App Store Search,artists,Music,Music，Semantics，Lyrics，Data，Images，Art，Engagement，Media，Referrals，Search
Music Updated,"Music Updated helps you stay up to date with the music you like. It's like a twitter newsfeed, but dedicated to music news and upcoming albums based on the artists you follow. It acquires some of this information by leveraging the Last.fm and YouTube APIs.",YouTube @@@ Last.fm,artists,"Music, Music, Notifications, News Services","Music,  Notifications, News Services，Video，Media"
Music Spider,"MSpider.net aims to help many different types of music lovers to explore music; one user can explore music of different regions or types, another might be curious to hear music related to an artist that he/she enjoys and another may want to generate a jukebox to play background music at the office. Because the music is located on youTube this creates an opportunity to find a wide range of results (interviews, live events, singles etc.). Users create stations to store their compilations and can share stations with their 'friends' by posting links on their facebook timeline.",YouTube @@@ Last.fm @@@ Facebook Graph,artists,"Music, Video, Aggregation, Search","Music, Video, Aggregation, Search，Media，Social，Demographics，Streaming，Webhooks"
uMusic,"Android application that uses several APIs to bring to the user all information of his/her favorite musics and artists, including discography, biography, lyrics and where to buy links.",Discogs @@@ LyrDB,artists,"Music, Lyrics, Search","Music, Lyrics, Search，Database"
33Revoluciones,"33revoluciones share information about modern music bands and artists, including biography, discography, songs and lyrics.",MusicBrainz @@@ Wikipedia @@@ ChartLyrics Lyric,artists,"Music, Search, Humor","Music, Search, Humor，Semantics，Reference，Wiki，Lyrics"
Setlisting,A site for setlists and statistics on artists concert chronology.,Google Maps @@@ Last.fm @@@ MusicBrainz @@@ Facebook @@@ Spotify Metadata @@@ Facebook Graph,artists,"Music, Events, Music, Tools","Music, Events, Tools，Mapping，Viewer，Semantics，Social，Webhooks，Social，Demographics，Streaming"
Molamp,Molamp is a really cool way of discovering and playing music. Search for an artist and Molamp returns not only videos from that artist but also recommendations of others to listen to.,YouTube @@@ Last.fm,artists,"Music, Search, Art","Music, Search, Art，Video，Media"
soundeer,A new way of discovering music artist and albums by reading tumblr reviews about them and browsing recomendations.,Tumblr @@@ SoundCloud @@@ Bandcamp,artists,"Music, Streaming, Search, Recommendations","Music, Streaming, Search, Recommendations，Social，Blogging，Audio，Lyrics"
Richseam,Looking for new music? Richseam.com lets you discover music through the collaborations and connections of your favourite artists,YouTube @@@ Last.fm @@@ MusicBrainz @@@ DBpedia @@@ Freebase @@@ Spotify Echo Nest @@@ Songkick @@@ Spotify Metadata,artists,"Music, Aggregation, Search, Search","Music, Aggregation, Search, Video,Media，Semantics，Wiki，Reference，Database，Data，Events"
Flowd,Flowd lets you mark your favorite spots on the map and tell your friends where the action is happening. Flowd also shows you the nearby gigs of your favorite artists!,Google Maps @@@ Twitter,artists,"Music, Mapping, Social","Music, Mapping, Social，Viewer，Blogging"
twusic,"Twusic is the simplest way to stream your Twitter music feed to your social network just by tweeting the song and artist's name together with the #nowplaying hashtag ! Explore and retweet your friends's radio stations and playlists, share your favorite tracks and check out what the world is listening to...t",Twitter,artists,Music,Music，Social，Blogging
Ivy FM - Discover new music every day,"Discover new music every day with Ivy FM. It plays great songs continuously in each genre from the best artists in the world. Select your channel, listen great music, share it and enjoy.",YouTube @@@ Last.fm,artists,"Music, Streaming","Music, Streaming，Video，Media"
Get Rhythm,"Enabling record labels to offer previews to artist fan clubs months in advance of releases, driving up pre-sales.",Twilio @@@ SendGrid,artists,"Music, Sales, Telephony","Music, Sales, Telephony，Voice，Text-to-Speech，Cloud，Webhooks，Email，Analytics，Marketing，Protocol"
Now Playing on BBC Radio,"See what tracks are playing on the radio, see artist information, news stories, events, images, biographies and reviews all in real-time to BBC national radio stations. Scrobble tracks to Last.fm or post to Facebook, all in realtime.",BBC @@@ Last.fm @@@ MusicBrainz @@@ Wikipedia @@@ Spotify Echo Nest @@@ BBC Music @@@ Songkick @@@ 7digital @@@ Facebook Graph,artists,"Music, Music, Real Time, Art","Music,  Real Time, Art，Media，England，TV，Semantics，Reference，Wiki，Data，Events，Streaming，Audio，Social，Demographics，Webhooks"
Music Bloodline,"Created at Music Hack Day Boston 2011, Music Bloodline is a visual representation of related musical artists, powered by Rovi API.",Rovi Cloud Services @@@ RPM Software,artists,"Music, Search","Music, Search，Entertainment，Recommendations，Movies，Advertising，Video"
Search Rhapsody by Phone,"Ever found yourself listening to a song in a restaurant or a club or at any place and don not have access to a PC. You can find out details of the song right away. SMS a few words from the track and we will get back with track, album and artist.",411Sync @@@ Rhapsody,artists,"Music, Messaging, Search, Mobile","Music, Messaging, Search, Mobile"
Rolling Stone Photos by Phone,"View the latest photos from events and artists from the Rolling Stone. Everyday, new photos. These photos can be viewed on all WAP capable phones.",411Sync,artists,"Music, Events, Mobile, Celebrities, Photos","Music, Events, Mobile, Celebrities, Photos"
musiCal,Gives an RSS feed of who from your top 50 artists in last.fm are coming to your town.,Upcoming.org @@@ Last.fm,artists,"Music, Events","Music, Events"
Rhapsody Top Feeds,A Google Gadget that polls top songs and album feeds from Rhapsody RSS to let users stay on top of news about their favorite artists.,Rhapsody @@@ Google Homepage,artists,"Music, Feeds, Widgets","Music, Feeds, Widgets"
MusicTonic,"Slick music information mashup with photos, videos and news. Search or browse artists by name or genre.",Amazon Product Advertising @@@ Yahoo Maps @@@ Last.fm @@@ Yahoo Image Search,artists,"Music, Photos, Video, News Services","Music, Photos, Video, News Services"
musotik,"Enter an artist name and get videos, discography, bio, torrents and related artists",YouTube @@@ Last.fm,artists,"Music, Video, Torrents, Audio","Music, Video, Torrents, Audio，API，Conversions，Intelligence，Passwords"
Music Artist Cloud,Generate a tag cloud from music artists similar to the one you submit. Use it find find new bands you like. Including YouTube music videos.,Amazon Product Advertising @@@ YouTube @@@ Yahoo Bbauth,artists,"Music, Cloud, Art, Visualizations","Music, Cloud, Art, Visualizations，Video，Media，Security，Authentication，Identity"
ExitAhead,Search eBay for music by artists from your last.fm profile.,eBay @@@ Last.fm,artists,"Music, Auctions, eCommerce","Music, Auctions, eCommerce，Search"
MySpace Top Music Artists by Phone,Find whats hot on MySpace Music anywhere. Get a run down of the top MySpace artists on your WAP capable phone by using the keyword myspacetop.,411Sync,artists,"Music, Telephony","Music, Telephony"
Last.fm Rankings,Rank your favorite artists and albums by an estimation of how long you have spent listening to them. Normalized rankings.,Last.fm @@@ MusicBrainz,artists,Music,Music，Semantics
MusicMash,"Search for an artist and view videos, photos, and a discography for the artist.",YouTube,artists,"Music, Video, Photos","Music, Video, Photos，Media"
Music Web Navigator,"Access point to music-related places on the Web. Enter an artist name and get links to 50+ manually selected sites, with biographies, discographies, songs, videos, photos, reviews, tabs, lyrics, covers, and more.",Last.fm @@@ FUTEF Wikipedia API,artists,"Music, Reference","Music, Reference"
Music.Podfire.org,"A music information aggregator that displays music news, album information, music videos, artists photos, music genres and tags for each artist.",Flickr @@@ Amazon A9 OpenSearch @@@ YouTube @@@ Yahoo Audio Search @@@ Last.fm @@@ Amazon S3 @@@ Google Ajax Search @@@ Amazon EC2,artists,"Music, News Services, Photos, Video, England, Audio","Music, News Services, Photos, Video, England, Audio，Media"
DukeTek Web Player,A small web player that plays music and shows images from the web that represent the current artist.,Yahoo Image Search @@@ SeeqPod,artists,"Music, Photos","Music, Photos，Search"
FriendCompare,Compare your musical interests with your last.fm friends and neighbors. See what's similar between you and your friends as well as what's different; and in the process discover music or artists that you never knew you loved!,Last.fm,artists,"Music, Comparisons","Music, Comparisons"
Obani Urban Music,Displays a list of ringtone and mp3 content available from Dada. Obani.com is passing the artist name to the search API. Dada is returning album art and a list of songs and track previews to Obani.com.,openDada,artists,"Music, eCommerce, Audio, Mobile","Music, eCommerce, Audio, Mobile，Social"
TuneChimp,"TuneChimp lets you discover the best music from any artist: Listen to top tracks, learn more about them through videos, photos, bios, news, and lyrics. This mashup uses APIs including Yahoo Boss, Last.fm and Flickr.",Flickr @@@ Last.fm @@@ Yahoo BOSS,artists,"Music, Photos, Video, Celebrities, Search","Music, Photos, Video, Celebrities, Search"
pop ularity,A music quiz where the player guesses which artist is most popular.,Last.fm @@@ Google Chart @@@ Spotify Echo Nest,artists,"Music, Music, Games","Music, Music, Games，Data"
The Explorer,"The Explorer uses the Youtube and New York Times APIs to give the user cool ways to find videos and get the latest news. It also has a youtube music playlist creator that allows the user to put in up to 5 artists, then it compiles a playlist for the user",YouTube @@@ New York Times Article Search,artists,"Music, News Services, Video","Music, News Services, Video，Media，Reference，Search"
Music Enthusiast,Search for your favorite artist. Be able to visually see locations of their upcoming concerts and events. Check out their hottest videos on YouTube.,Eventful @@@ Google Maps @@@ YouTube,artists,"Music, Video, Mapping, Events, Events","Music, Video, Mapping, Events, Calendars，Guides，Viewer，Media"
My Fav Bands,A comprehensible site to track your favorite artists. Subscribe to RSS feeds to get informed about new releases and gigs in your city.,Last.fm @@@ Spotify Metadata @@@ iTunes and iTunes Connect,artists,"Music, Music","Music, Other，Mobile，eCommerce"
Music Artist Cloud App,Android app that lets you discover music bands and artists similar to your favorites. Integrates with Last.fm and YouTube and uses tagclouds to find related artists.,YouTube @@@ Last.fm @@@ Google App Engine,artists,"Music, Mobile, Video, Search","Music, Mobile, Video, Search，Media，Tools，Cloud，Webhooks"
Music Favmap,"A map of the favorite music of Last.fm listeners. Circles to the right of the map have more plays per listener. The Y axis shows chronology, with the oldest tracks at the top of the chart. The larger the circle, the more plays the artist has received.",YouTube @@@ Last.fm,artists,"Music, Visualizations","Music, Visualizations，Video，Media"
The Music Feed,"Featuring free, unlimited MP3 downloads by independent artists and DJs from the Underground Music Spot plus your favorite mainstream artists. Mashup of the Underground Music Spot and Interactive Digital Music.",Google AdSense @@@ Google Ajax Search @@@ Facebook @@@ Twitter @@@ Google Ajax Feeds @@@ Google Custom Search @@@ LinkedIn @@@ Tumblr @@@ Google Webmaster Tools @@@ iLike @@@ Google App Engine @@@ Yahoo Social Directory @@@ Google Analytics Managment @@@ Tinysong @@@ twt.fm @@@ Google Buzz @@@ Grooveshark @@@ Tiny-URL Open @@@ Facebook Social Plugins,artists,"Music, Search","Music, Search，Advertising，SEO，Social，Webhooks，Blogging，Enterprise，Blogging，Tools，Cloud，Streaming，Audio，URL Shortener，Widgets"
Music2Mail,Music2Mail.com is a music notification service. You can subscribe to a list of your favorite artists and receive an email whenever one of these artists has a new release. Search artists or import from Last.fm.,MusicBrainz,artists,"Music, Search, Social","Music, Search, Social，Semantics"
Music Artists info,"Music Artists Info is a mashup that shows information on a chosen artist. It shows photos, biography, top albums, top tracks and upcoming events. Events are marked on a map and you can watch a video of top tracks.",YouTube @@@ Last.fm @@@ Map24 AJAX,artists,"Music, Humor, Reference, Photos, Mapping","Music, Humor, Reference, Photos, Mapping，Video，Media"
Viral Music List,"Viral Music List is a site that keeps track of Spotify links on Facebook. By keeping track of the number of times different Spotify links are shared, Viral Music List is able to present different charts with artists, albums and specific tracks.",Facebook @@@ Spotify Metadata,artists,"Music, Social","Music, Social，Webhooks"
Hunch + TinySong,Personalized artist recommendations and instant full-length preview of their songs using the Hunch and TinySong APIs.,Tinysong @@@ Hunch,artists,"Music, Search, Social","Music, Search, Social，Streaming"
MusicWall,"Discover new artists and music with an app based on Last.fm and YouTube APIs. MusicWall creates a list after you provide an artist's name and lets you browse similar artists, discover new music, rediscover old music, or even ""go classical"".",YouTube @@@ Last.fm @@@ Spotify Metadata,artists,"Music, Music, Video, Social","Music, Video, Social，Media"
SpotiLast,SpotiLast generates a personalized Spotify playlist based on the artists suggested to you by Last.fm.,Last.fm @@@ Spotify Metadata,artists,"Music, Recommendations, Music","Music, Recommendations, Music"
Last Echos in the Cloud,"Provide your lastfm username and the script will get your Top Played Artists of the last 12 months, fetch the three latest reviews from Cloudspeakers and the top two similar artists from Echo Nest.",Last.fm @@@ Spotify Echo Nest @@@ Cloudspeakers,artists,Music,Music，Data
Normalisr,A little application to rank your favourite artists and albums by an estimation of how long you have spent listening to them.,Last.fm @@@ MusicBrainz,artists,Music,Music，Semantics
One Page Artist,"One stop shop to view media and know everything about any music artist on one page. Combines YouTube, Last.fm, Google Maps and Amazon shopping APIs.",Amazon Product Advertising @@@ Google Maps @@@ YouTube @@@ Last.fm,artists,"Music, Art, Events, Video, Music, Mapping","Music, Art, Events, Video,  Mapping，Data，Geography，Media"
Ewi - Pewter: streaming radio real-time search,"The Ewi - Pewter is the music streaming radio real-time search service. You can find radio stations that streams the music, by entering artist name.",Yes Broadcast DB,artists,"Music, Music, Search, Streaming","Music, Music, Search, Streaming，Reference"
Last on AM/FM,Visualizes what's currently playing on your radio station and maps the artists to their place of residence or origin. You can also add your last.fm recently played tracks.,Google Maps @@@ Yahoo Maps @@@ YouTube @@@ Last.fm @@@ Freebase @@@ Wikipedia @@@ Google App Engine @@@ Google Analytics Managment,artists,"Music, Art, Music, Mapping, Visualizations","Music, Art,  Mapping, Visualizations，Viewer，Video，Media，Database，Reference，Wiki，Tools，Cloud，Webhooks"
Estonian Music Database,A site about Estonian music ja bands. Youtube and vimeo videos are updated automatically and similar artists are shown based on last.fm similar artists feed. The website is running on Wordpress blogging system.,Google Maps @@@ YouTube @@@ Last.fm @@@ Vimeo @@@ Lyricsfly,artists,"Music, Video, Lyrics, Art","Music, Video, Lyrics, Art，Mapping，Viewer，Media,Community,Content,Movies,Transcoding"
Tweekly.fm,Tweekly.fm is a mashup between last.fm and twitter. It sends a weekly tweet listing your top weekly artists with their playcounts.,Last.fm @@@ Twitter,artists,"Music, Blogging","Music, Blogging，Social"
TubeGotChi Music Artists,"A place where you can gather information about music artists from videos, imeem songs, playlists, lyrics, news, last.fm artists and more.",YouTube @@@ Last.fm @@@ LyricWiki @@@ Imeem @@@ Yahoo BOSS,artists,"Music, Lyrics, Video, Search","Music, Lyrics, Video, Search，Media"
Your Own Music Television,This mashup takes your top 50 artists and plays random music videos by those artists. It can go full screen and you can play your lastFM friends favorite artists too.,YouTube @@@ Last.fm,artists,"Music, Video","Music, Video，Media"
Popstar.com,Celebrity mashup that uses the MTV Content API for music artists and videos.,MTV,artists,"Music, Video, Celebrities, Events","Music, Video, Celebrities, Events"
DLdisco,The mashup of discogs.com and filestube.com. Find the whole discography of your favorite artist or band in seconds and download links as well.,Discogs @@@ FilesTube,artists,Music,Music，File Sharing，Search
MusicDNA ID,"MusicDNA ID discovers and identifies music wherever you go and whenever you want. Whether you are in a bar, in a department store or listening to music in a car, simply record a short snippet of the unknown song, send it to us and within seconds we will let you know what is the name of the song and the performing artist.",Seatwave,artists,"Music, Search, Search, Identity","Music, Search, Identity，Entertainment，eCommerce，Events，Sports，Tickets"
Sonos Enhanced,"Enhances the current Spotify integration on Sonos by providing playlisting and similar artists and providing upcoming concert listings, via Seatwave APIs.",Spotify Metadata @@@ Sonos Music @@@ Seatwave,artists,"Music, Search","Music, Search,Internet of Things，Entertainment，eCommerce，Events，Sports，Tickets"
Jplayer for bandcamp,Populate your jplayer playlist with a bandcamp artist discography.,Bandcamp,artists,"Music, Music","Music, Lyrics"
BandStalk,Tracks new music releases from selected artists. Imports lists from Facebook and Last.fm and notifies via email.,Last.fm @@@ MusicBrainz @@@ Twitter @@@ Spotify Metadata @@@ Facebook Graph @@@ Facebook Social Plugins,artists,"Music, Music, Social",Music，Social，Semantics，Blogging，Demographics，Streaming，Webhooks，Widgets
allSongsBy,allSongsBy provides full song listings for any artist via YouTube's vast free music collection. Lists are organized by artist and album.,YouTube @@@ iTunes and iTunes Connect,artists,"Music, Search, Video","Music, Search, Video，Media，Other，Mobile，eCommerce"
"The Think About It ""TALK"" About It Show","The Think About It,""TALK"" About It Show (TATAI), is a radio talk show that allows the caller to interact with the radio host live about current events and other issues. Live interviews with recording artists, politicians and more.",Twilio,artists,"Music, Telephony, Voice","Music, Telephony, Voice，Text-to-Speech，Cloud，Webhooks"
SeekIt.gr,"A library and search engine about music. Query song titles, singers, song description or lyrics. Browse artists, music genre or albums.",YouTube @@@ Last.fm @@@ Google Base @@@ ChartLyrics Lyric @@@ Next Big Sound,artists,"Music, Video, Search","Music, Video, Search，Media，Lyrics，Social，Data"
Spotisoma,Spotisoma is an application that lets users create a Spotify playlist with Soma.fm tracks. This application uses the Spotify Metadata API service.,Spotify Metadata,artists,Music,Music
Mixblast,"Mixblast is an application that creates quick Youtube playlists out of text lists. It uses the Last.fm API, as well as reads RSS feeds.",YouTube @@@ Last.fm,artists,"Music, Lists, Video","Music,Lists,Video"
Nostalgia,Swedish website that lists old music charts and lets the users find the music of their youth. The website is integrated with Spotify and Youtube so it's possible to both listen to the songs as well as view the music videos. This webapp offers a current billboard as well as music classified by year.,Spotify Web @@@ YouTube,artists,"Music, Charts","Music,Charts"
doob.fm,"Doob.fm is a free music-streaming site with custom online radio and audio/video scrobbler functionality. Doob.fm consumes the Last.fm API and enables users to play tracks on-demand, listen to internet radio, create custom playlists, watch music videos, check local venues for concerts and shows, view music charts, read through song lyrics, and more.",Last.fm,artists,"Music, Audio, Video","Music,Audio,Video"
Songs Near Me,"Songs Near Me is a web application that allows a user to search for TouchTunes jukeboxes in any city in North America, and have the ability to stream the songs currently playing on the jukebox live in a browser. It also works on a mobile device as well as a tablet. Listeners can discover new music based on what is popular at a local bar, hometown, or college pub. The Songs Near Me web app employes the TouchTunes Jukebox API to collect venue song data, and queries Soundcloud, Spotify, YouTube, and Rdio APIs to play the song where it is available.",TouchTunes Jukebox @@@ SoundCloud @@@ Spotify Metadata @@@ Rdio @@@ YouTube,artists,"Music, Location, Real Time, Streaming","Music,Location,Real Time,Streaming"
My Saved Tracks,"This web app mashup is a demo that allows users to fetch saved tracks from their Spotify account using the Spotify Metadata API. Users are first asked for permission, and then the app retrieves their saved tracks and displays them as a list. The app is made by Paul Lamere, and the source code is located on GitHub.",Spotify Metadata,artists,Music,Music
re/spin,"Re/Spin leverages the Last.fm, Rdio, and Spotify Metadata API to allow music lovers to import any of their hand crafted playlists into Rdio.",Last.fm @@@ Spotify Metadata @@@ Rdio,artists,"Music, Music","Music,Music"
SoundYouNeed,"Find Sound You Need and share your joy! SYN was developed to help and improve the experience for searching your favorite music similar on Soundcloud, YouTube and Spotify.",YouTube @@@ SoundCloud @@@ Spotify Metadata @@@ Grooveshark,artists,"Music, Search","Music,Search"
Videva,"Videva.com is the biggest music video database on the Internet. All the artists, all the videos, at a click's distance. Putting together the Last.fm music catalog and the Youtube video catalog, Videva brings you the most structured music video search tool to date. Discover new artists and new videos, or listen to your favorite music through our simple interface.",YouTube @@@ Last.fm @@@ Facebook @@@ iTunes & App Store Search,artists,"Music, Video, Video","Music,Video,Video"
MusicNectar,"MusicNectar is a mashup of lastfm, and youtube. The aim of MusicNectar is to make listening to youtube music videos easier, and more informative.",YouTube @@@ Last.fm,artists,"Music, Applications","Music,Applications"
Punk'n'Roll - Watch and Listen to Rock Music,"Watch and listen to Punk, Rock'n'Roll, Psychobilly, Rockabilly, Grunge and other rock music genres compiled from submissions to rock music subreddits.",YouTube @@@ Reddit,artists,"Music, Search, Aggregation, Video","Music,Search,Aggregation,Video"
Soundcry,Soundcry is a media search engine and playlist management tool.,YouTube @@@ Last.fm @@@ MusicBrainz @@@ Facebook @@@ Vimeo @@@ SoundCloud @@@ Spotify Echo Nest @@@ Dailymotion,artists,"Music, Search, Music, Social","Music,Search,Music,Social"
MvBanana,MvBanana is a radio station that plays music videos. This is a fun way of discovering new or forgotten music.,YouTube @@@ Lyricsfly @@@ MusixMatch,artists,"Music, Video, Aggregation, Streaming","Music,Video,Aggregation,Streaming"
Cyborg Karaoke Party,A Music Hack Day application using karaoke tracks from Rdio and a text to speech library to convert synchronized lyrics from LyricFind to digital speech.,Rdio @@@ LyricFind,artists,"Music, Humor, Entertainment","Music,Humor,Entertainment"
Austin City Limits Music Festival radio,"Discover all the artists playing at thse 2013 Austin City Limits Music Festival taking place on October 4-6 & 11-13 in Austin, TX with ACL.fm, the unofficial radio app for ACL Fest.",YouTube @@@ Last.fm,artists,"Music, Music, Events","Music,Music,Events"
Visual Groove,"Visual Groove is total entertainment experience: music with accompanying imagery. Visual Groove is a ground-breaking digital music service that aggregates and displays images in an entertaining way during song play. With on-demand access to Rdio, Visual Groove has access to over 12 million songs.",Rdio,artists,"Music, Video, Search, Aggregation, Humor","Music,Video,Search,Aggregation,Humor"
