MashupName,desc,APIs,primary_category,all_category,tags
Prezi Real Time Collaboration,This map displays how many Prezi users are collaborating across the world at any one time. This powerful visualization is displayed using Google Maps.,Google Maps,Map,"Map, Humor, Visualizations, Collaboration","Map, Humor, Visualizations, Collaboration,Location,Viewer,Data,Geography,Visualizations,Enterprise"
UKBirdCount,"UKBirdMap is a Google Map of bird sightings reported via Twitter. Tweets with the hashtag #ukbirdcount, a UK postcode and the species of bird spotted are automatically added to the map in real-time.",Google Maps @@@ Twitter,Map,"Map, Reference, Nature, Animals","Map, Reference, Nature, Animals,Location,Viewer,Data,Geography,Visualizations,Enterprise"
Maps of All,"MapsOfAll is Google Maps mashup, where you can see map tiles from different providers like Bing or Openstreetmap",Google Maps @@@ OpenStreetMap,Map,"Map, Map, Map","Map,,Location,Viewer,Data,Geography,Visualizations,Enterprise"
Metro Mapper,Multiple maps of data for Metro Louisville KY from government sources.,Google Maps @@@ Your Mapper,Map,"Map, Statistics","Map, Statistics,Location,Viewer,Data,Geography,Visualizations,Enterprise"
NYC Big Maps,Multiple maps of data for New York City from government sources.,Google Maps @@@ Disqus @@@ Your Mapper,Map,Map,"Map,Crime,Location,Viewer,Data,Geography,Visualizations,Enterprise"
Jefferson County PVA Property Values,Map of all property values across the county.,Your Mapper,Map,"Map, Search, Tools","Map, Search, Tools,Crime"
CartoDB HTML5 maps,A handful of examples for using CartoDB API data to develop advanced HTML5 maps.,CartoDB,Map,"Map, Map, HTML5, Map, Map","Map, Map, HTML5, Map, Map"
Travel Baseball Team Locator,This mashup allows travel baseball coaches to add their team to the map and communicate with other coaches directly from the mashup.,Google Maps @@@ Google Geocoding,Map,"Map, Map, Events","Map, Map, Events,Location,Viewer,Data,Geography,Visualizations,Enterprise"
Strange Strollers Oxfam Trailtrekker 2012 Training Map,"This map was created to record our team training efforts as we prepare for the Oxfam Trailtrekker 2012 challenge. Oxfam Trailtrekker is a 100km trek for teams of four, over 30 hours (yes, that's day and night!) across the Yorkshire Dales National Park, and takes place 26th-27th May 2012.",Google Maps @@@ Twitter @@@ Instagram,Map,"Map, Reference","Map, Reference,Location,Viewer,Data,Geography,Visualizations,Enterprise"
cairoDot,Interactive map of Cairo.,Google Maps,Map,Map,"Map,Location,Viewer,Data,Geography,Visualizations,Enterprise"
Google Map Atlas,"This is a world atlas using google maps api to show both maps and earth images of places all over the world, divided by place type (mount,river etc)",Google Maps @@@ Google Picasa @@@ Google Earth @@@ Google Maps Data,Map,Map,"Map,Location,Viewer,Data,Geography,Visualizations,Enterprise"
WifiPDX,"Since 2004, WifiPDX has been Portland's wireless Internet connection. The new version of the site has updated maps and geolocation options.",Google Maps @@@ Google Geocoding,Map,Map,"Map,Location,Viewer,Data,Geography,Visualizations,Enterprise"
Novels: On Location,A Google-Maps/Amazon mash-up for finding books that take place where you're traveling. Browse or search the map and make your next destination come alive!,Amazon Product Advertising @@@ Google Maps,Map,"Map, Books, Map, Travel","Map, Books, Map, Travel,Location,Viewer,Data,Geography,Visualizations,Enterprise"
Nerdy Day Trips,"A giant, inclusive, user-generated nerd map of nerdy funtime destinations. From sea forts to abandoned nuclear bunkers, dead victorian racecourses, roads that are falling into the ground, narrow gauge railways and more.",Google Maps,Map,"Map, Social, Visualizations","Map, Social, Visualizations,Location,Viewer,Data,Geography,Visualizations,Enterprise"
FIND Free Maps,"FIND Free Maps allows you to create, customize, annotate and PDF your own maps. With no need to register or download any software, FIND Free Maps is designed for you to simply use. You can customize the map styling to suit your own needs using the 'Your Google Map' feature.",Google Maps Flash,Map,"Map, England, Map","Map, England, Map"
Hot Tubbers,"Natural hot and mineral springs across the United States. Interactive maps, user reviews and GPS coordinates for each listing.",Google Maps,Map,"Map, Search, Reference","Map, Search, Reference,Location,Viewer,Data,Geography,Visualizations,Enterprise"
Berlin Gay Maps,"Maps of gay bars, clubs, hotels, shops etc. in Berlin Sch?neberg, Kreuzberg, Friedrichshain and Prenzlauer Berg. See under the GayMap link on the main menu.",Google Maps,Map,"Map, German, Adult, Bars","Map, German, Adult, Bars,Location,Viewer,Data,Geography,Visualizations,Enterprise"
Nearish,"Nearish.com puts you on a map with other Facebook users, allowing you to connect with people around you in realtime and ""visit"" others far away.",Google Maps @@@ Facebook,Map,"Map, Social, Visualizations, Reference","Map, Social, Visualizations, Reference,Location,Viewer,Data,Geography,Visualizations,Enterprise"
UK rail passenger tweet mashup,"Rail passenger tweets are plotted on a map, highlighting tweets about delays and cancellations.",Google Maps @@@ Twitter,Map,"Map, England, Transportation, Reference, Visualizations, Social","Map, England, Transportation, Reference, Visualizations, Social"
Gecko,"Gecko is the world's first all-in-one tool for mobile app developers to create Indoor Positioning of the Smartphone including support for maps of the indoor locations, accurate user position and integrated friend finder functionality.",LocLizard,Map,"Map, Map, Tools, Map","Map, Map, Tools, Map"
TargetMap,"Free online mapping tool to see and share your data on GoogleMaps. Just choose a country and a way to create your map by color, type values or by uploading your excel files (you can even use your zip/postal code column to get the best and most accurate maps). Publish and share maps.",Google Maps @@@ Facebook @@@ Twitter,Map,"Map, Reference, Visualizations, Social","Map, Reference, Visualizations, Social,Location,Viewer,Data,Geography,Visualizations,Enterprise"
San Francisco School-Pot Map,The site mashes up San Francisco public-school and marijuana-dispensary data. The map shows walking distances from each public school to the nearest marijuana dispensary and vice versa.,Google Maps @@@ Facebook @@@ Twitter,Map,Map,"Map,Location,Viewer,Data,Geography,Visualizations,Enterprise"
CartoLogic Google Maps Demo,"This map from Cartologic is using cartoview to show Twitter, Gowalla, Foursquare, Youtube, Yelp, Flickr, Weather, Events, Wikipedia with the Google Maps API.",Flickr @@@ Google Maps @@@ YouTube @@@ Twitter @@@ Yelp @@@ Weather Channel @@@ Wikipedia @@@ foursquare @@@ Gowalla,Map,Map,Map
CartoLogic OpenLayers Demo,"This map from Cartologic is using cartoview to show Twitter, Gowalla, Foursquare, Youtube, Yelp, Flickr, Weather, Events, Wikipedia with an OpenLayers map.",Flickr @@@ YouTube @@@ OpenLayers @@@ Twitter @@@ Yelp @@@ Weather Channel @@@ Wikipedia @@@ foursquare @@@ Gowalla,Map,Map,Map
CartoLogic Google Earth Demo,"This map from Cartologic is using cartoview to show Twitter, Gowalla, Foursquare, Youtube, Yelp, Flickr, Weather, Events, Wikipedia with the Google Earth browser plug-in.",Flickr @@@ YouTube @@@ Twitter @@@ Yelp @@@ Weather Channel @@@ Google Earth @@@ Wikipedia @@@ foursquare @@@ Gowalla,Map,Map,Map
Maponics School Boundaries,This mashup allows users to choose from several school districts and see maps of school attendance zones and neighborhood boundaries.,Maponics,Map,"Map, Education, Localization, Map, Education","Map, Education, Localization, Map, Education"
Maponics Neighborhood Boundaries: Point Geotagging,This mashup allows users to enter a US address and returns a map of the address point within the neighborhood polygon.,Maponics,Map,"Map, Localization","Map, Localization"
Salesforce International Mapping,"Display a Bing map on Account, Contact or any other custom object. Supports language localisation, custom icons, built using Visualforce components so easier to reuse, and can run in Group, Professional, Enterprise and Unlimited Editions.",Google Maps @@@ Salesforce.com,Map,"Sales, Enterprise, Customer Relationship Management, Map","Sales, Enterprise, Customer Relationship Management, Map,Location,Viewer,Data,Geography,Visualizations,Enterprise"
The Web 2.0 Summit Points of Control Map,"A custom Google map to visualize the tech industry major players. Outlines points of control, replete with incumbents and insurgents ??those companies who hold great swaths of strategic territory, and those who are attempting to gain ground, whether they be startups or large companies moving into new ground. Inspired in part by board games like Risk or Stratego, and in part by the fantastic and fictional lands of authors like Tolkien and Swift.",Google Maps,Map,"Map, Events, Visualizations","Map, Events, Visualizations"
Florida Public School Scores,"Interactive Map of FCAT Scores by School, District and Zip Code. FCAT Stands for Florida Comprehensive Assessment Test. Uses Google Maps and the MapLarge API",Google Maps @@@ MapLarge,Map,"Map, Education, Map","Map, Education, Map"
World Cup Soccer 2010 Venues,A map mashup of World Cup Soccer 2010 Venues along with a StreetView look at the venues.,Google Maps,Map,"Map, Sports, Sports, Map, Photos","Map, Sports, Sports, Map, Photos"
World Cup Soccer Tweets,"A map mashup showing the latest tweets related to World Cup Soccer 2010, from around the world.",Google Maps @@@ Twitter,Map,"Map, Sports, Sports, Sports, Blogging","Map, Sports, Sports, Sports, Blogging"
Union County North Carolina Community Mapper,"A web map that lets users simply find ownership and tax information as well as their nearest parks, libraries, fire stations, walkability, etc.",Google Maps,Map,"Map, Localization","Map, Localization"
Tuitrafico,"Spanish traffic information in real time and via Twitter. Maps of traffic incidents, price of fuel in gas stations, charts, reporting of incidents via user tweets.",Google Maps @@@ Twitter @@@ Google Chart @@@ Google AJAX Libraries,Map,"Map, Transportation, Transportation, Charts, Spanish","Map, Transportation, Transportation, Charts, Spanish"
Southern California Earthquake Tweets,Google Maps Mashup which looks at tweets from Southern California (related to earthquake). The tweets are within 750 miles radius from Los Angeles. The map moves on to the next tweet after 5 seconds.,Google Maps,Map,"Map, Earthquakes, Blogging","Map, Earthquakes, Blogging"
MSHT3,"MSHT3 is a pure Google Maps version 3 mashup utilizing new Google Geocoding and Elevation services, combined with Yahoo! Query Language accessing Yahoo! Geoplanet. US Zip Code and County polygons are displayed, when available, from PropertyMaps.com.",Google Maps @@@ Yahoo Query Language @@@ Yahoo GeoPlanet @@@ Google Maps Data @@@ Bing Maps @@@ TownMe Geo @@@ Google Maps Elevation,Map,"Map, Map, Blogging, Map","Map, Map, Blogging, Map"
LA County Solar Map,Interactive map showing solar installations in Los Angeles.,Bing Maps,Map,"Map, Solar","Map, Solar"
San Francisco Solar Map,Interactive maps showing off existing solar power installations in San Francisco.,Google Maps,Map,"Map, Environment, Sustainability","Map, Environment, Sustainability"
MyLocalTribune,A visual Google Maps and Twitter mashup lets you find local updates from local tribunes.,Google Maps @@@ Twitter,Map,"Map, News Services, Blogging, Localization, Blogging","Map, News Services, Blogging, Localization, Blogging"
Geo Talk,Forums connected to a map. Mark a place and then type a question. In other words create an initiation for a discussion and get a unique link for the map.,Google Maps @@@ Disqus,Map,"Map, Social","Map, Social"
Dear Map,Create your own maps and share with friends.,Google Maps @@@ Google Ajax Search @@@ Google Static Maps @@@ Google AJAX Language @@@ Google Visualization @@@ Google Earth,Map,"Map, Map, Map, Photos","Map, Map, Map, Photos"
Maponics ZIP Code Boundaries,This mashup allows users to enter a US address and returns a map of the address point within the ZIP Code polygon.,Maponics,Map,"Map, Map, Map, Zip Codes, Application Development","Map, Map, Map, Zip Codes, Application Development"
Hardiness Zone Map,Interactive USDA plant zone hardiness map.,Google Maps,Map,"Map, Education, Reference, Government","Map, Education, Reference, Government"
Global Flood Map,Interactive map that allows what areas would be flooded or at risk due to sea level rises that may be related to Global Warming. Users can enter their own estimate and see which cities are flooded.,Google Maps @@@ Google Maps Flash @@@ MapLarge,Map,"Map, Weather, Weather","Map, Weather, Weather"
What Bus? London Bus Route Map,Integrated map of London's bus routes.,Google Maps,Map,"Map, Transportation, Travel, Transportation","Map, Transportation, Travel, Transportation"
London Attractions Map,"Map of attractions in London, England.",Google Maps,Map,"Map, Travel, England","Map, Travel, England"
Ottawa Attractions Map,"Map of Ottawa attractions, such as Parliament Hill, Royal Canadian Mint, and the Supreme Court of Canada.",Google Maps,Map,"Map, Travel, Canadian","Map, Travel, Canadian"
Stars and Planetarium Search,"Get maps and information about your favorite stars, plus view maps. Get star, planetarium, and observatory information.",Flickr @@@ Google Maps @@@ YouTube @@@ SimpleAPI,Map,"Map, Video, Photos, Japanese, Astronomy","Map, Video, Photos, Japanese, Astronomy"
Maps For Smartphone,Get your favorite maps on the small display screen of your smartphones.,Google Maps @@@ Microsoft Bing Maps @@@ OpenStreetMap @@@ ViaMichelin,Map,"Map, Mobile, Telephony","Map, Mobile, Telephony"
Iraq Coalition,"Interactive map of current and past members of the Iraq Multinational Coalition, current troop count by country, and related links.",Google Maps @@@ Google AdSense,Map,"Map, Government, Map, News Services","Map, Government, Map, News Services"
Geoviu,Geoviu is an online platform that allows you to see information and news on a map. Built using Google Maps Flash.,Google Search @@@ Google Maps Flash,Map,"Map, News Services","Map,News Services"
Alpharetta Home,"Real estate, foreclosure, school performance, demographic and employment heat maps for Alpharetta, Georgia.",Google Maps,Map,"Map, Real Estate, Education","Map,Real Estate,Education"
AIRCN Flight Simulate Map,Flight simulation on a map. In Chinese.,Google Maps Flash,Map,"Map, Air Travel, Chinese","Map,Air Travel,Chinese"
Meetup for the iPhone,Find Meetup groups in your area based on topic keyword and current geographic location.,Meetup,Map,"Map, Events, Mobile, Localization","Map,Events,Mobile,Localization"
GeoMeme,"Measure and share real-time local Twitter trends. App uses Twitter, Google Maps and Yahoo Term Extraction APIs.",Google Maps @@@ Yahoo Term Extraction @@@ Twitter @@@ Google Static Maps @@@ Google App Engine,Map,"Map, Mobile, Social, Blogging","Map,Mobile,Social,Blogging"
govpulse,"Finalist in the Apps for America 2 mashup contest. GovPulse.us provides access to a database of articles from the Federal Register, the journal of the federal government. use filters to decide what is important to you.",CloudMade,Map,"Map, Government, Government","Map,Government,Government"
Tupalo,"A social yellow pages services where you can discover, rate and review local businesses and services around the world. Find restaurants, bars, boutiques, salons and other businsses.",Flickr @@@ Google Maps @@@ Last.fm @@@ GeoNames @@@ Amazon S3 @@@ Google AdSense @@@ Twitter @@@ Hyves @@@ Google Analytics Managment,Map,"Map, Localization, eCommerce, Photos, Search, Reference","Map,Localization,eCommerce,Photos,Search,Reference"
Plantmaps,Plant and gardening maps featuring an interactive USDA zone hardiness map.,Google Maps,Map,"Map, Nature, Education, Science","Map,Nature,Education,Science"
RealGeni Real Estate Search Engine,RealGeni 2.0 is a real-time automated real estate search engine aggregator that uses Google Base and Google Maps to give an accurate and effective service for finding properties.,Google Maps @@@ Google Base,Map,"Map, Real Estate, Aggregation, Search","Map,Real Estate,Aggregation,Search"
GeoImpress,"GeoImpress provides a completely new way to search for places all over the world. Integrates Google Maps, Flickr, and Twitter.",Flickr @@@ Google Maps @@@ Twitter,Map,"Map, Map, Photos, Blogging","Map,Map,Photos,Blogging"
Yard Sale Treasure Map,"Find and map the Craigslist yard sales near you. Find, organize, and print directions to yard sales in your area. You can make live updates to your itinerary to find the fastest route.",Google Maps,Map,"Map, Sales, eCommerce","Map,Sales,eCommerce"
Imaginalaxy,"Photo sharing an enormous 2-d surface. GoogleMaps-style navigation. Place, arrange, rotate, re-size images to form photo collages. Edit images in real-time with friends. Share to Facebook, Myspace, and other services.",Flickr @@@ Amazon S3 @@@ Facebook @@@ MySpace,Map,"Map, Social, Photos, Social","Map,Social,Photos,Social"
View Satellite Imagery at Full Browser Window,"View satellite imagery at full screen, dynamic update to the URL for every move of the view. Bookmark current view and come back later, or shows your friends for a particular location. Lets you populate articles and photos to current view.",Google Maps @@@ Panoramio,Map,"Map, Travel, Satellites, Photos","Map,Travel,Satellites,Photos"
Custom World Maps,Simple mapping tool that generates custom color maps of the world.,Yahoo Widgets @@@ Google Chart,Map,"Map, Charts, Education, Widgets","Map,Charts,Education,Widgets"
CNN iReports Map,"The CNN iReports Map, set on the Barack Obama inauguration parade route, allows readers to submit their own stories and reports from the event.",Google Maps,Map,"Map, Government, History, News Services, Government","Map,Government,History,News Services,Government"
Barack Obama Inauguration Map,MSNBC has an interative map highlighting points of interest along parade route to the White House where he will take the oath of office. Has layers of overlaid data that can be toggled on and off.,Microsoft Bing Maps,Map,"Map, Government, Travel, History, Government","Map,Government,Travel,History,Government"
Worldmaster Game,Challenging Flash-based game built on Google Maps Flash. Connect flags and capitals.,Google Maps Flash,Map,"Map, Map, Games","Map,Map,Games"
Spot2be App,A short url service for locations. Share your locations among devices the easiest way possible.,Google Maps @@@ Facebook @@@ Twitter @@@ Faviconz,Map,"Map, Messaging, Social, Tools","Map,Messaging,Social,Tools"
Gaza Attack Timeline,Google Map Mashup of Gaza Strip attack by Israel. Shows Day by Day events in Gaza and Israel and casualties of Palestinians and Israelis. Data Source from The Guardian News.,Google Maps,Map,"Map, News Services","Map,News Services"
Find Countries on the Map,Find countries on the map and score points. Playing it several times will help improve your geography knowledge.,Google Maps @@@ Google Chart @@@ Google AJAX Libraries @@@ Google App Engine,Map,"Map, Education, Map, Games","Map,Education,Map,Games"
Progressive Contacts,"Progressive Contacts is a fundraising company that specializes in making phone calls (live, automated phone surveys, and automated phone calls) to reach supporters for different political campaigns. Some of the services that Progressive Contacts provide include text messaging, field consulting, financial consulting, data analysis, script drafting, and more.",NationBuilder,phone,Telephony,Phone，Social，Community，Organization，Government，Management
Code It,Code It allows users to write code without leaving their Firefox OS phone. The aplication uses the HackerEarth API to help with enabling coding capabilities.,HackerEarth,phone,"Telephony, Application Development, Tools","Phone, Application Development, Tools，Application Development"
Auto Attendant (Open Source),"This is an open source project (using PHP) for Auto Attendant, which is a telephony app that handles incoming calls and transfer to phone numbers. Also includes recording voicemail and sending SMS reminder.",Google URL Shortener @@@ Hoiio SMS @@@ Hoiio Voice,phone,"Telephony, Directories, Voice, Telephony","Phone, Directories, Voice, Phone，Messaging，Telephony，Text-to-Speech"
Free phone chat,"Using Twilio, qmpeople.com is the first social network which permits registered users to make free chats by using their cell phones. It is sufficient to click on ""Phone chat"" and our system will try to call two cell phones to establish a private channel among them.",Twilio,phone,"Telephony, Chat","Phone, Chat，Telephony，Voice，Text-to-Speech，Cloud，Webhooks"
Bevoz,"Access your personal phone book from any phone with a simple phone call or from a computer. A lost, stolen, uncharged or damaged cell phone doesn't mean you've lost access to your contacts. As a Bevoz member you have backup access from any phone worldwide. Simply dial the Bevoz access number and use your personalized secure PIN to access your account contacts.",Twilio,phone,"Telephony, Voice, Mobile, Contacts","Phone, Voice, Mobile, Contacts，Telephony，Text-to-Speech，Cloud，Webhooks"
DocuSign and Twilio,"DocuSign already gives you the option of voiding an Envelope after you've sent it (like recalling an email), but what if you could void an Envelope while on the go, without internet service? With access to the DocuSign API and Twilio, we can grab information about Envelopes (and execute actions) from a phone call!",DocuSign Enterprise @@@ Twilio,phone,"Telephony, Electronic Signature","Phone, Electronic Signature，Enterprise，Contracts，Documents，Telephony，Voice，Text-to-Speech，Cloud，Webhooks"
Mania de Celular,"ManiadeCelular.com.br is a community for cell phone and electronics consumers. Ask and answer questions, read tips, reviews and ratings from other members or from the Mobile Mania staff. See releases from all major device manufacturers and carriers.",Yahoo Answers,phone,"Telephony, Mobile, Social, Reference","Phone, Mobile, Social, Reference，Q&A"
y!Vmail - voice mail for your Yahoo! Mail,"This hack allows people to access their Yahoo! mail through a 1-800 number, using ANY touch-tone phone. Press 0 to open, * and # to navigate, 7 to delete. We figure out which emails are important, and read them first. We summarize long emails so that you dont have to listen to all of it. If you want to talk to the person, just press 5 '?we'll connect you.",Yahoo Mail @@@ Yahoo Address Book @@@ Twilio,phone,"Telephony, Telephony",Phone，Telephony，Voice，Text-to-Speech，Cloud，Webhooks
Laugh-o-Tron,"""The only electronic comedy delivery service not on the internet."" Dial a phone number and hear a joke.",Twilio,phone,"Telephony, Mobile, Humor, Social","Phone, Mobile, Humor, Social，Telephony，Voice，Text-to-Speech，Cloud，Webhooks"
Teletka,"Teletka is an online/phone service that allows you to connect your Facebook account with phone numbers. Once you are officially authenticated with Teletka, you can start posting audio messages to your Facebook wall. All you have to do is call Teletka and leave a message.",Facebook @@@ Google App Engine @@@ Twilio,phone,"Telephony, Messaging, Social","Phone, Messaging, Social，Webhooks，Tools，Cloud，Telephony，Voice，Text-to-Speech"
Cloudient Conference Call Facilitator,"User may setup a conference call with participants, their phone numbers, and a start time. At the appointed time, this application calls all of the participants and links them together in a conference call. It also provides complete reporting on who actually participated.",Twilio,phone,Telephony,Phone，Telephony，Voice，Text-to-Speech，Cloud，Webhooks
Handoff,Handoff is a web/phone conferencing demo. It allows users to create rooms via the web or their phone and enter a room with the correct room and pin number.,Twilio,phone,"Telephony, Telephony",Phone，Telephony，Voice，Text-to-Speech，Cloud，Webhooks
MiniDates,"MiniDat.es is an online speed dating application that connects singles via actual phone conversations rather than impersonal chat rooms or emails. Along the same lines of speed dating, our phone conversations or ""mini dates"" are limited to three minutes each. This is enough time for users to meet each other and chat but not too much time in case someone isn't interested or doesn't feel a connection. When the three minutes are up, users are asked if they would like to continue the conversation. If both users say ""yes"", the connection stays open and they can talk on MiniDat.es for as long as they want. But if someone says ""no"", the connection is closed and both people go their separate ways. No hurt feelings, no need to ""let her down easily"" and no awkward, half-hug on your doorstep.",Facebook @@@ Twilio,phone,"Telephony, Social, Dating","Phone, Social, Dating，Webhooks，Telephony，Voice，Text-to-Speech，Cloud"
Asesor,"Asesor is an asynchronous, distributed medical question/translation/answer app. It brings together patients in rural areas of 3rd world countries, translators for those patients, and doctors to answer those patients' questions. Through the app, patients can simply use their telephone to call in and record their medical question. Translators from around the world can then see that question, and translate it into English. Doctors around the world then see the question in English and provide an answer. The original translator can then call the patient back straight from their browser and deliver the doctor's answer in the patient's native language.",Twilio @@@ Twilio SMS,phone,"Telephony, Medical, Voice","Phone, Medical, Voice，Telephony，Text-to-Speech，Cloud，Webhooks"
