MashupName,desc,APIs,primary_category,all_category,tags
TripsQ,"TripsQ turns airport checkins into various travel statistics. Foursquare can users sign in to tripsQ to visualize trips and travel itineraries. Provides users with detailed statistics on distance traveled, amount of CO2 produced during each trip and other information.",Google Maps @@@ foursquare,travel,"Travel, Visualizations, Mobile, Social, Search","Travel, Visualizations, Mobile, Social, Search"
100 travel destinations,Site showing images and text from 100 worldwide travel locations. From Antarctica to Zanzibar- travel destinations around the world.,Google Maps @@@ Twitter,travel,"Travel, Photos","Travel, Photos"
Asiya Travels Online,"Asiya Travels Online offer a wide variety of online booking for domestic and international airlines, bus, rail, car, hotel packages, Esselworld and more. The Asiya Travels Online directory is an effort to bring the major ticketing agencies of India under one roof as to help the online user in making the best choice from a wide array of options.",Yahoo Travel,travel,"Travel, Indian","Travel, Indian"
See Your Hotel,"Map based Hotel locator. The easiest way to see where you will stay. We provide the streetview, flickr, YouTube and Twitter info on the hotel, so you know where you'll stay while travelling.",Flickr @@@ Google Maps @@@ YouTube @@@ Twitter,travel,"Travel, Mapping, Hotels","Travel, Mapping, Hotels"
Alaska Travel Guide,"Search thousands of Alaska travel listings for lodging, tours, cruises and transportation for Alaskan cities such as Fairbanks, Denali Park, Anchorage, Seward, Kenai, Kodiak, Skagway, Ketchikan and Juneau.",Google Maps,travel,"Travel, Mapping","Travel, Mapping"
Kukunu,"Kukunu is a new travel planning experience that simplifies the life of travellers around the world. Travelers can collaborate to create their itinerary then add transports, hotels, restaurants, activities and sights across the cities they plan to visit.",Flickr @@@ Google Maps @@@ Google Ajax Search @@@ Facebook @@@ Bit.ly,travel,Travel,Travel
Geolover,"Geolover is a tool for tourists and travelers. Build your own travel guide and take it with you. Combines APIs including Foursquare, Twitter, YouTube and Flickr.",Flickr @@@ Google Maps @@@ YouTube @@@ Twitter @@@ Google Static Maps @@@ Google Maps Data @@@ foursquare,travel,"Travel, Blogging, Video, Photos, Mapping","Travel, Blogging, Video, Photos, Mapping"
PlaceMix,Travel search mashup portal that lets users track all the information about their favorite places. Also uses World66 open guide book and CIA Factbook maps. More on the way.,Flickr @@@ Upcoming.org @@@ Google Search @@@ Google Maps @@@ Yahoo Search @@@ YouTube @@@ Kayak @@@ GeoNames @@@ Facebook @@@ Yelp @@@ Weather Channel @@@ World Time Engine @@@ Wikipedia,travel,"Travel, Search, Photos, Mapping, Weather, API Management","Travel, Search, Photos, Mapping, Weather, API Management"
Virtual Highway from New Zealand Transport Agency,Virtual Highway is a website that provides video images of key travel routes and maps of the New Zealand state highway network. This information is very useful to people such as tourists and New Zealanders who are not local to an area.,Google Maps Flash,travel,"Travel, Transportation, Mapping, Government","Travel, Transportation, Mapping, Government"
Togfrog Adventure Travel Videos,Togfrog is videos with maps covering a wide selection of adventure travel activities that can inspire and guide travelers going on adventures all over the world.,Google Maps @@@ YouTube,travel,"Travel, Video, Mapping, Humor, Recreation, Sports","Travel, Video, Mapping, Humor, Recreation, Sports"
Travel Mixed,"Travel information from a variety of sources. Search for anywhere in the world and see maps, local sights and more.",Flickr @@@ Google Search @@@ Google Maps @@@ Yahoo Geocoding @@@ Google AdSense @@@ Yahoo Answers @@@ Panoramio @@@ Google Webmaster Tools @@@ Wikipedia @@@ Yahoo Query Language,travel,Travel,Travel
Viamigo,"Viamigo helps travelers, journalists and travel professionals find authentic, local experiences and insider adventures, by connecting them with travel services everywhere. Integrates the Rezgo XML API into the ""Bookable Tours"" section.",Rezgo,travel,"Travel, Tourism, Tourism, News Services","Travel, Tourism, Tourism, News Services"
Safiri.dk Travel Search,"Travel search engine, with last minute offers, and travel destination information in Danish.",Google Maps @@@ GeoNames @@@ WeatherBug @@@ Panoramio @@@ Wikipedia,travel,"Travel, Photos, Nordic, Weather, Mapping","Travel, Photos, Nordic, Weather, Mapping"
Worldsaurus.com Travel Guide,"Worldsaurus.com is a worldwide travel guide to help adventurous budget-travelers, backpackers, photographers, and vacationers plan their trips. Find the most popular places in the world, with detailed information.",Flickr @@@ Google Maps,travel,"Travel, Hotels, Mapping","Travel, Hotels, Mapping"
Street Traveler,Each post in Street Traveler represents a street scenery of a selected place in Google Street View. It is a place for you to hang around when you feel like to go somewhere. Virtually travel around the places we dream of is just a matter of time commitment,Flickr @@@ Google Maps @@@ YouTube @@@ Google Maps Flash,travel,"Travel, Mapping, Mapping, Video, Photos","Travel, Mapping, Mapping, Video, Photos"
Map of Botswana,"Shows the location of safari camps and lodges in Botswana's Okavango Delta, with recent traveler reviews, photos and short descriptions. You can also add this map to your own site or blog.",Google Maps,travel,"Travel, Mapping, African","Travel, Mapping, African,Location,Viewer,Data,Geography,Visualizations,Enterprise"
TravelMapia,"World Travel Guide featuring Video and pictures of, hotels, resorts and restaurants on an interactive Google Map.",Google Maps @@@ YouTube,travel,"Travel, Video, Mapping","Travel, Video, Mapping"
Sightseeing Tours,"Mashup of Google Maps, travel products and an XML feed.",Google Maps,travel,"Travel, Mapping","Travel, Mapping"
OK Travel Australia,okTravel is an Australia travel web-site with the goal of displaying statistical data as culture.,Google Maps @@@ GeoNames @@@ OpenLayers,travel,"Travel, Demographics, Charts, Australian, Mapping","Travel, Demographics, Charts, Australian, Mapping"
Fun Tourist Attractions,"A showcase of the best travel attractions around the world with videos, maps, descriptions, recent blog posts and pictures for almost every attraction.",Flickr @@@ Google Maps @@@ YouTube @@@ Akismet @@@ Panoramio,travel,"Travel, Attractions, Mapping, Video, Photos","Travel, Attractions, Mapping, Video, Photos"
Travel at RoamEarth.com,"Photos, videos and destinations on the map. Submit your own travelogues and travel tips, upload your own photos.",Google Maps @@@ YouTube @@@ Panoramio,travel,"Travel, Mapping, Video, Photos","Travel, Mapping, Video, Photos,Location,Viewer,Data,Geography,Visualizations,Enterprise"
Where Can I Live?,Find a new place to live with a travel time search. It works on commuting time between stations (Underground and DLR only) and average house prices. You can also view property listings around your chosen station and fun stuff like house price statistics.,Google Maps @@@ OpenStreetMap @@@ Nestoria @@@ CloudMade,travel,"Travel, Search, Transportation, Travel, England, Mapping","Travel, Search, Transportation, Travel, England, Mapping,Location,Viewer,Data,Geography,Visualizations,Enterprise"
GeckoGo,"Travel planning site for independent travelers integrating Google Maps, Flickr, and various social networks for photo albums, trip planning, blogging and guide browsing.",Flickr @@@ Google Maps @@@ Facebook,travel,"Travel, Mapping, Photos, Planning, Social","Travel, Mapping, Photos, Planning, Social,Location,Viewer,Data,Geography,Visualizations,Enterprise"
Travel Around the World,"Provides a world tour with images, details, and videos of tourist spots that you can visit when you travel to that country.",AOL Video,travel,"Travel, Video, Tourism","Travel, Video, Tourism"
Turismo Peru,"Tourism in Peru. Guide to travel agencies, tourist services, cities, tours, history, adventure, nature, gastronomy, pictures, and videos of Peru.",Google Maps,travel,"Travel, Mapping","Travel, Mapping,Location,Viewer,Data,Geography,Visualizations,Enterprise"
iGuide,"Interactive Travel Guide featuring 16,000+ destination guides, a full-screen interactive map, traveler reviews, videos, and 10,000+ photos. Combines Google Maps, WikiTravel, Wikipedia, Placeopedia, YouTube, and Google Video.",Google Maps @@@ YouTube @@@ Google AdSense @@@ Google Ajax Search,travel,"Travel, Air Travel, Hotels, Video, Mapping","Travel, Air Travel, Hotels, Video, Mapping,Location,Viewer,Data,Geography,Visualizations,Enterprise"
Monumental Adventure,Take a video tour around London and add your own content to this graphically rich travel video mashup.,Microsoft Bing Maps,travel,"Travel, Video, England, Mapping","Travel, Video, England, Mapping"
You.travel Interactive Travel Guide,"You.travel features a cool interactive full-screen map along with travel guides to over 16,000 destinations, traveler reviews, and over 10,000 photos.",Google Maps,travel,"Travel, Mapping, Hotels, Air Travel, Mapping","Travel, Mapping, Hotels, Air Travel, Mapping,Location,Viewer,Data,Geography,Visualizations,Enterprise"
TripHub,"A collaborative way to plan, coordinate, and share gatherings that involve travel.",Microsoft Bing Maps,travel,"Travel, Mapping, Social, Events","Travel, Mapping, Social, Events"
Touropia,"Provides an overview of travel highlights around the world using interactive maps with destinations such as cities, beaches, national parks and cultural sites.",Flickr @@@ Google Maps @@@ YouTube,travel,"Travel, Mapping, Photos, Video","Travel, Mapping, Photos, Video,Location,Viewer,Data,Geography,Visualizations,Enterprise"
iloho.com,Combines digg-like voting system with maps and other utilities for travelers.,Google Maps,travel,"Travel, Mapping, Social","Travel, Mapping, Social,Location,Viewer,Data,Geography,Visualizations,Enterprise"
Regent Seven Seas Cruises,The SharedBook API was used to develop an interface to give the passengers of Regent Seven Seas Cruises the ability to pick and choose content from the specific ports they visited to include in their travel books.,SharedBook,travel,"Travel, Books","Travel, Books,Social"
Motel 6 Attraction Finder,"By combining the Motel 6 property database with a list of attractions and cross-indexing them in Google Maps, the Attraction Finder functions as a searchable trip planner. Also, make a reservation near a desired vacation spot.",Google Maps,travel,"Travel, Mapping","Travel, Mapping,Location,Viewer,Data,Geography,Visualizations,Enterprise"
eeeHOP,Yet another web2.0 travel application that helps you find the holiday rentals. Most are located in France and Italy.,Google Maps,travel,"Travel, Real Estate, Mapping, Italian, French","Travel, Real Estate, Mapping, Italian, French,Location,Viewer,Data,Geography,Visualizations,Enterprise"
Mileage Calculator,"You can use this tool to calculate travel mileage for any number of trips, fetching information from Google Maps. Better yet, if you have trips entered in Google Calendar, you can fetch those events towards calculating mileage.",Google Maps @@@ Google Calendar,travel,"Travel, Mapping","Travel, Mapping,Location,Viewer,Data,Geography,Visualizations,Enterprise,Calendars"
NY Times Where To Go in 2007,The New York Times mashup of the best travel destinations for 2007. Map markers link to full stories in the Times travel section.,Google Maps,travel,"Travel, Mapping","Travel, Mapping,Location,Viewer,Data,Geography,Visualizations,Enterprise"
Online Bed and Breakfast Directory,"Online bed and breakfast directory with listings worldwide, travel gift certificates and Blog.",Google Maps,travel,"Travel, Mapping, Hotels","Travel, Mapping, Hotels,Location,Viewer,Data,Geography,Visualizations,Enterprise"
Sunshine Coast BC Community Site,"Not an exciting mashup but I use four different APIs to deliver fresh, useful, or interesting content to this British Columbia travel site.",Flickr @@@ Google Maps @@@ Yahoo Search,travel,"Travel, Mapping, Canadian, Photos","Travel, Mapping, Canadian, Photos,Location,Viewer,Data,Geography,Visualizations,Enterprise"
Ojor.com,"World Community, travel, photos, videos. Data from Yahoo Maps, Yahoo Travel, Flickr and YouTube.",Flickr @@@ Yahoo Maps @@@ YouTube @@@ Yahoo Travel,travel,"Travel, Video, Photos, Mapping","Travel, Video, Photos, Mapping"
TripCart,TripCart is designed by travelers for travelers. We sort through the world of travel information to make it easy for you to plan the best possible trip.,Google Maps,travel,"Travel, Mapping","Travel, Mapping"
Geowalk,"A useful worldwide travel guide in German and English. With embedded data from Wikipedia, Flickr and Google News. Double-click anywhere on the map for details on that location.",Flickr @@@ Google Maps @@@ GeoNames,travel,"Travel, News Services, Mapping, German","Travel, News Services, Mapping, German,Location,Viewer,Data,Geography,Visualizations,Enterprise"
QuestGlobe,Travel Information Directory. Mashup of Naver and Flickr.,Flickr @@@ Naver,travel,"Travel, Search, Photos, Korean","Travel, Search, Photos, Korean"
VCarious,"VCarious is a community-based travel portal. Explore the world via dynamic travel guides, create journals, upload photos, and use other social features.",Google Maps,travel,"Travel, Mapping","Travel, Mapping,Location,Viewer,Data,Geography,Visualizations,Enterprise"
drop!in v1.2.3,"The Drop!in v1.2.3 Mashup helps users locate events that are taking place within the proximity of their locations. The application detects and lists corporate events, social activities, or fun destinations where individuals can visit to engage in past time or work-related activities.",Eventful,travel,"Events, Addresses, Location, Travel","Events,Addresses,Location,Travel"
UK Beaches,"A comprehensive guide for coastal activities with specific information on all UK beaches. Uses Google Maps, OpenStreetMap and a number of smaller APIs for weather. Whether you are looking for a beach holiday, a day at the coast, a coastal path walk, information on beaches, tourist attractions or energetic sports activities, this site and social channels has the details.",Google Maps @@@ OpenStreetMap @@@ Facebook,travel,"Travel, Guides, Hotels, Mapping, Social","Travel,Guides,Hotels,Mapping,Social"
TapTravel,TapTravel is a mobile application that allows users to search for and book for flights. TapTravel is available in all major mobile platforms. The Allmyles API has been integrated into this application.,Allmyles,travel,"Air Travel, Booking, Payments, Tickets","Air Travel,Booking,Payments,Tickets"
Fireflies,Fireflies is a web application that allows travelers to search for various traveling options and destinations domestically and internationally. The Allmyles API service has been integrated with this application.,Allmyles,travel,"Air Travel, Booking, Payments, Tickets","Air Travel,Booking,Payments,Tickets"
Triporia Hotel Search,Triporia Hotel Search is an application that enables users to search for hotels based on dates and location. This application uses Expedia API.,Expedia,travel,"Hotels, Travel","Hotels,Travel"
Triporia,Triporia is a web application that enables users to compare different hotels in United Kingdom. This application uses the Expedia API.,Expedia,travel,"Travel, Hotels","Travel,Hotels"
Elsy Arres Flights,"Elsy Arres Flights is a web application that lets users search for upcoming flights by providing their departure location, and their destination. This application uses the Elsy Arres Flights API service.",Pyton Flight Portal,travel,"Air Travel, Booking","Air Travel,Booking"
Uber Calculator & Statistics,This simple web app allows users to calculate the current cost for Uber rides. This application uses the Google Maps API.,Google Maps,travel,"Transportation, Statistics, Travel","Transportation,Statistics,Travel"
Going out in Paris?,"""Où sortir à Paris ?"" is a mobile application, designed for users in Paris, France. This application lets users find information about local events in Paris.",Paris Is,travel,"Travel, Events, French","Travel,Events,French"
OzNewsy,OzNewsy is a mobile application that enables users to explore the history and culture of their current location while being in Australia. This mashup uses National Library of Australia Trove API.,National Library of Australia Trove,travel,"Tourism, Travel","Tourism,Travel"
Zilyo Vacation Rental,"Zilyo gives you access to over 2 million accommodation listings across the world in over 200,000 destinations. Whether for leisure or business, Zilyo returns results for short term rentals ranging from apartments, houses, cottages, villas, castles, and even igloos, from all over the world. The following suppliers are currently supported: Airbnb, HomeAway, AlwaysOnVacation, ApartmentsApart, BookingPal, BedyCasa, CitiesReference, Geronimo, Gloveler, HolidayVelvet, HomeStay, HostelWorld, HouseTrip, Interhome, 9Flats, Roomorama, StopSleepGo, TheOtherHome, Travelmob, VacationRentalPeople, VaycayHero, WayToStay, and WebChalet.",AirBNB @@@ ApartmentsApart @@@ 9flats @@@ Roomorama @@@ Zilyo Vacation Rental,travel,"Travel, Booking, Rentals, Search","Travel,Booking,Rentals,Search"
Attractions of America,"Attractions of America lists top 10 attractions in each of the 50 States of America. Destinations include top beaches, top museums, top nightlife places, and top romantic destinations. The site shows the categories of things to do, US map, deals, and photos. Attractions of America invites users to add a favorite attraction at no cost with the aim to increase the number of adventures presented on the site.",Google AdSense,travel,"Tourism, Recreation, Travel, USA","Tourism,Recreation,Travel,USA"
eRail.in Indian Railways,"eRail.in offers gateways for accessing real time train information from the Indian Railway database. Users can check train availability, booking logistics, track train time arrivals, and more using mobile apps for iOS, Android, and Windows, as well as through a web interface.",eRail.in Indian Railways,travel,"Transportation, Data, Location, Prices, Real Time, Time Tracking, Travel","Transportation,Data,Location,Prices,Real Time,Time Tracking,Travel"
Smssafar,"Smssafar is an online booking company that provides customer services tailored to unique traveling needs. Some of these services include finding flights, booking hotels, and pairing users with relevant tour packages. Routes booked through Smssafar are in India only.",i2space,travel,"Booking, Air Travel, Travel","Booking,Air Travel,Travel"
TrivAsia,"TrivAsia is an online booking company that supplies information on different destinations in Asia. The TrivAsia services include booking flights, finding travel packages, searching for hotels, and more.",i2space,travel,"Booking, Air Travel, Travel","Booking,Air Travel,Travel"
99flights,"99flights is an online flight booking company that provides access to information regarding the different available flights for their travels. Additionally, it also offers other services such as finding domestic cars, hotels, and nearby attractions.",i2space,travel,"Booking, Air Travel","Booking,Air Travel"
Hamkry,"Hamkry is an online booking company that provides customers access to travel-related information such as booking flights, buses, hotels, and car rentals.",i2space,travel,"Booking, Air Travel, Transportation, Travel","Booking,Air Travel,Transportation,Travel"
Flymore,"Flymore is an online booking company that provides customers access to different travel-related offers and deals. Some of these services include booking flights, hotel reservations, and car rentals.",i2space,travel,"Booking, Air Travel, Travel","Booking,Air Travel,Travel"
Signin,"Signin.in is a travel booking company that offers different types of booking services such as air ticket, bus tickets, train tickets, car rentals, holiday packages, and more.",i2space,travel,"Booking, Air Travel, Tickets, Travel","Booking,Air Travel,Tickets,Travel"
LaalBus,LaalBus is an online booking company for buses covering all regions of India. Customers will be able to find and book bus tickets for their travel needs.,i2space,travel,"Booking, Travel","Booking,Travel"
Funtimeplanner,Funtimeplanner helps users plan trips by providing information on the top events and venues across the UK.,Culture24,travel,"Tourism, Travel, Tools, Aggregation","Tourism,Travel,Tools,Aggregation"
Plan My Hotel,"Search all major hotel accommodation websites and compare rates, so that you make best decision to stay & enjoy your trip. PlanMyHotel.com provides an extensive database more than 300,000 hotels all over the world and an easy to use hotel search engine to enable you finding & comparing hotels deals.",HotelsCombined @@@ Hotelston,travel,"Holidays, Hotels, Travel, Tourism, Discounts","Holidays,Hotels,Travel,Tourism,Discounts"
Amtrak Train Routes,This mashup displays the location of Amtrak trains in real-time. Users can click on routes to see a closer view of the travel status.,Google Maps,travel,"Mapping, Travel, Visualizations, Real Time","Mapping,Travel,Visualizations,Real Time"
Online Booking Software,"Find the simple and easiest way to build an online booking system like Expedia with this script. It is possible to offer many service with this script like hotel booking, travel booking, vacation rentals and many more.",Kayak @@@ Travel Booking Engine @@@ Magento @@@ Expedia @@@ Travel Booking Network,travel,"Booking, Application Development, Travel","Booking,Application Development,Travel"
Nova Scotia Cottage Rentals,At Sea Scotia Vacation Rentals we want you to have the Nova Scotia Vacation of a lifetime. We have some of the finest Nova Scotia Cottages and Nova Scotia Vacation rentals. All locations are listed on the map.,Google Maps,travel,"Canadian, Real Estate, Travel","Canadian,Real Estate,Travel"
youbeQ - Maps with Life,"What's going on around you? Points of interest, businesses, news and events. Explore the Earth, meet new people, discover new places and share.",Google Maps @@@ Google Static Maps @@@ Google Earth @@@ Google Geocoding @@@ Google Street View Image,travel,"Science, Mapping, Social, Travel, Guides","Science,Mapping,Social,Travel,Guides"
Rate Tour Guides,Rate Tour Guides is a fun way to discover locations around the World in a 1st person view.,Google Maps @@@ Google Mashup Editor @@@ Google Maps Flash @@@ Google Maps Data @@@ Google Maps Elevation,travel,"Mapping, Travel, Mapping, Tourism, Tourism","Mapping,Travel,Mapping,Tourism,Tourism"
Skypicker,Skypicker is a European low-cost airline ticker search engine that displays results on Google Maps. The tool has several search filters that make finding the right flight easy.,Google Maps,travel,"Mapping, Travel, Search, Visualizations","Mapping,Travel,Search,Visualizations"
Pothole Season,"Pothole Season is a service that displays the location of potholes on a map. If you are looking to go for a drive and want to avoid bumpy roads, this mashup is just for you.",Google Maps,travel,"Visualizations, Humor, Mapping, Travel","Visualizations,Humor,Mapping,Travel"
BreweryMap,"BreweryMap is your guide to finding the best in craft breweries. Whether you're at your computer or on the go, BreweryMap can help you discover a new world of great beer. With a constantly growing database of over 4,600 breweries and more than 23,000 beers, you can always find something new!",Brewery DB,travel,"Breweries, Beer, Mapping, Breweries, Travel, Mapping","Breweries,Beer,Mapping,Breweries,Travel,Mapping"
Projectr,"This mashup draws from the YouTube API for random and endless playback from YouTube retro videos. Videogames and video stock from 70's, 60's, world wars, etc..",YouTube,video,"Video, Entertainment","Video, Entertainment，Media"
HashTagMyAss,"Hashtagmyass is a web application that allows users to create videos using photos that are found on their Instagram account. Customers have the options to purchase a music track of their choice to create their video, either on Beatport or Itunes; prices vary depending on the chosen record.",Impossible Software,video,"Video, Art, Photos","Video, Art, Photos，Editing，Encoding，Streaming，Tools，Transcoding"
G Downloader,"G Downloader is a website that lets users download videos from many of the most popular video sharing sites without having to leave the site, all for free. Users can search for videos on G Downloader and upon finding them, will be given a URL to download the link.",YouTube @@@ Dailymotion,video,Video,Video，Media，Social，TV
Funny Vines - Thebestvines.tv,This Mashup aggregates Vine videos from around the world. Have fun searching for new videos that you have not yet seen.,YouTube @@@ Facebook @@@ Twitter,video,"Video, Search, Aggregation","Video, Search, Aggregation,Media,Social,Webhooks,Blogging"
Chili's Promotion,"On this site, you can customize the video of a bag lunch puppet. The video customization requires only a single API call.",Impossible Software,video,"Video, Humor, Social","Video, Humor, Social,Editing,Encoding,Streaming,Tools,Transcoding"
mademyday.tv,"Collect and share all that makes your day fun and better.View daily best videos selected by You, your friends and others.",YouTube @@@ Facebook,video,"Video, Music, Humor","Video, Music, Humor,Media,Social,Webhooks"
Ministry Ops,"Ministry Ops is a simple hosted platform for churches and ministries to publish & share audio and video files. Just upload your video and it's converted, and distributed",YouTube @@@ Amazon S3 @@@ Vimeo @@@ Google AJAX Libraries @@@ New Relic @@@ Planning Center @@@ Airbrake @@@ Amazon SNS @@@ iTunes & App Store Search,video,"Video, Religion","Video,Religion,Media,Community,Content,Movies,Transcoding,Tools,Music,Calendars,Messaging,USA,Referrals,Search"
