MashupName,desc,APIs,primary_category,all_category,tags
BadgePlz,"Social photo badges for PicPlz, Burstn, Snapr and more. Display your follower count, number of photos and photos on your website or blog.",Instagram @@@ Burstn @@@ Snapr @@@ PicPlz @@@ Steply,photo,"Photos, Social, Blogging, Widgets","Photos, Social, Blogging, Widgets,Mobile,Upload"
flickstr,"See the weekly top 20 users from Flickr, as well as a selection of their highest-rated photos. Also options to see most favorites photos, most commented photos and most-used cameras.",Flickr @@@ Google AdSense @@@ Google Analytics Managment @@@ Bing @@@ Amazon Marketplace Web Service,photo,Photos,"Photos，Video,Advertising,SEO,Search,Translation,Reference"
WippiW,WippiW is a French critic photo platform. It collects your photos from Flickr or Picasa to post them to the site and get critical feedback and advice from other members.,Flickr @@@ Google Picasa,photo,"Photos, Social, Education, French, French","Photos, Social, Education, French, French，Video"
Pictarine,"A social network to share photos. It collects automatically all your photos and contacts from Facebook, Flickr and Picasa and allows you to share your photos with your friends whatever their website is.",Flickr @@@ Facebook @@@ Google Picasa @@@ Google Contacts @@@ Google App Engine,photo,"Photos, Social","Photos, Social，Video,Webhooks,Other,Contacts,Tasks,Applications"
Mashup Arts,"Create video and photo ecards. Lets you integrate community content from Facebook, Flickr Picasa, and YouTube. Collaborate with a social ecard.",Flickr @@@ del.icio.us @@@ Google Search @@@ YouTube @@@ Amazon S3 @@@ Google AdSense @@@ Facebook @@@ Amazon EC2 @@@ WebThumb @@@ Twitter @@@ Google Picasa @@@ Digg @@@ Picnik @@@ MySpace @@@ Google Analytics Managment,photo,"Photos, Video, Identity, eCommerce","Photos, Video, Identity, eCommerce,Bookmarks,Social,Media,Advertising,SEO,Webhooks,Blogging"
Beds and Bedroom News,A real-time list of the most recent tweets and Flickr photos concerning beds and bedrooms. More feeds to come.,Flickr @@@ Twitter @@@ Yahoo Query Language,photo,"Photos, News Services, Blogging","Photos, News Services, Blogging，Video,Social"
Slidemap,A site devoted to photos from around the world.,Flickr @@@ Yahoo Maps,photo,"Photos, Mapping","Photos, Mapping，Video"
Arab Channel,Arabic entertainment website. Integrates photos from Flickr and videos from YouTube.,Flickr @@@ YouTube,photo,"Photos, Video","Photos, Video,Media"
Memorybook,A puzzle-match game that integrates the photos of your Facebook friends. It was built using the Sharendipity platform.,Facebook,photo,"Photos, Humor, Social","Photos, Humor, Social,Webhooks"
Flickr Scramble,A photo puzzle game that integrates photos from Flickr. This game was built using the sharendipity platform.,Flickr,photo,"Photos, Games","Photos, Games，Video"
Tag Galaxy,"An application that uses Flash to explore Flickr photos via virtual 3D planetary systems. Enter a tag, and the related galaxy appears on screen. When you click on a sun, the images are placed on a 3D rotating globe.",Flickr,photo,"Photos, Search, 3D, Visualizations, Astronomy","Photos, Search, 3D, Visualizations, Astronomy，Video"
Molotron,A simple mashup showing interesting Flickr photos.,Flickr,photo,"Photos, Visualizations","Photos, Visualizations，Video"
Silverlight Photo Carousel,A Silverlight 1.0-based photo carousel displaying interesting photos from Flickr. The application was implemented in Script#.,Flickr,photo,Photos,Photos，Video
iPhone Maniacs,"Visit the News, Photos, and Videos pages on this website to see mashups of the keyword 'iPhone' with flickr photos, revver videos, and Google news. The mashups deliver the latest updates about the iPhone.",Flickr @@@ YouTube @@@ Revver @@@ Google Ajax Feeds,photo,"Photos, eCommerce, Video","Photos, eCommerce, Video,Media,Search"
TravelPod,Online travel blog with Flickr photo integration.,Flickr,photo,"Photos, Travel, Blogging","Photos, Travel, Blogging，Video"
MeyshanSlide,"MeyshanSlide sample application that gives you a slideshow of your photo stored in Picasa, Riya and Flickr. Built with phpflickr.",Flickr @@@ Riya @@@ Google Picasa,photo,Photos,Photos，Video
Summer of,"SummerOf.com gives you photos from typical holiday locations. But the twist is that you can select which summer you want to see pictures from, like Paris 2004.",Flickr,photo,"Photos, Travel","Photos, Travel，Video"
Flickr Lightbox Slideshow,Slideshow of most interesting and recent photos from flickr using the Lightbox Ajax tools.,Flickr,photo,Photos,Photos，Video
Webmunism,"Combines YouTube videos, Flickr photos, Last.fm albums and Amazon books, grouped by Wikipedia category.",Flickr @@@ Amazon Product Advertising @@@ YouTube @@@ Last.fm,photo,"Photos, eCommerce, Video, Music, Reference","Photos, eCommerce, Video, Music, Reference,Media"
favcol,See what color is currently the favorite one for photos on Flickr. Histogram of color bars at top of page are based on the current sampling.,Flickr,photo,Photos,Photos，Video
grou.ps,"Sharing platform for social groups which integrates mapping, photo sharing, link sharing and other services.",Flickr @@@ PayPal @@@ Amazon Product Advertising @@@ del.icio.us @@@ Google Maps @@@ geocoder @@@ Yahoo Geocoding @@@ geocoder.ca @@@ GeoNames,photo,"Photos, Mapping","Photos, Mapping，Video,Payments，eCommerce，Financial,Invoicing，Bookmarks，Social，Viewer，Addresses，Canadian，Reference，Weather，Postal，Database"
Magic Mosaic,"Magic Mosaic provides a fast, user-friendly way to create photo mosaics built from photos in online web albums and photo galleries.",Google Picasa @@@ Flickr @@@ Facebook @@@ PayPal,photo,"Photos, Art, Editing","Photos, Art, Editing，Video，Social，Webhooks，Payments，eCommerce，Financial，Invoicing"
SnapsBoard,"SnapsBoard help to preserve photos and videos in the original resolution. The mashup's principle: ""never lose a photo,"" is related to privacy, personalization, and categorization found in the app. While organizing digital images could be important for some members, others prefer to print images from a smart phone. That's why SnapsBoard offers a Walgreen's printing service connected to the phone.",Walgreens QuickPrints,photo,"Photos, Printing, Video","Photos, Printing, Video，API，SDK"
StoryWheel,This mashup allows users to narrate a story and use their Instagram photos as the backdrop. This is a creative and fun way to share your adventures with friends.,Instagram,photo,"Photos, Humor, Visualizations","Photos, Humor, Visualizations，Mobile"
Fotobabble Business Marketing Collection,"Sample business generated talking photos, used for marketing purposes. Engage customers and then share on popular social media sites like Facebook and Twitter.",Facebook @@@ Twitter,photo,"Photos, Visualizations, Video, Social","Photos, Visualizations, Video, Social，Webhooks，Blogging"
My Flickr for Thrutu,Share a Flickr photostream via phone call. Share each other's photos and public Flickr photos as well.,Flickr @@@ Thrutu,photo,"Photos, Mobile, Social, Telephony","Photos, Mobile, Social, Telephony，Video，Telephony，Real Time"
Effected,"Effected allows users to crop, re-size and apply a variety of Aviary filters to uploaded images and easily post them in your Facebook photo albums.",Aviary Effects,photo,"Photos, Humor, Visualizations, Social","Photos, Humor, Visualizations, Social"
PicWash Photo Retouch Service,"PicWash is a photo retouch service where real designers edit user photos starting at $7 each. We remove acne, whiten teeth, reduce wrinkles, facial shine, and more. Our service is connected to APIs of major photo storage and sharing sites.",Flickr @@@ Smugmug @@@ Facebook @@@ Google Picasa @@@ Photobucket,photo,Photos,Photos，Video，Social，Webhooks
Expono iPhoto Plugin,A plugin for Apple's iPhoto application to export photos to expono.com.,Expono,photo,"Photos, Backup","Photos, Backup"
photofunia,A photo manipulation site. A mashup with Touchnote that allows you to send postcards from the site.,Touchnote,photo,"Photos, Printing, Postcards","Photos, Printing, Postcards"
Funny Photo,"Free online service for creating funny pics from your photos. Makes a photo mashup in one click. Many templates. Uses an advanced face detection mechanism, based on the pho.to Enhancement Platform.",pho.to,photo,"Photos, Humor","Photos, Humor，Editing，Entertainment"
Flickr Flip Book,"View Flickr photos Photo Album style. Photo details include description, tags, and comments. Use the arrow keys to flip through photos and spacebar to zoom in-out. Also includes slideshow playback and Search by Tag via Photo and Album tag clouds.",Flickr,photo,"Photos, Music","Photos, Music,Video"
Migratr,"Migratr is a desktop application which moves photos between popular photo sharing services. Migrates your metadata, including titles, tags, descriptions and album org. Services supported: Flickr, Faces, Picasa, Phanfare, Zenfolio Zooomr and others.",Flickr @@@ Smugmug @@@ 23 @@@ AOL Pictures @@@ Phanfare @@@ Faces.com @@@ Google Picasa @@@ Photobucket @@@ Zooomr,photo,"Photos, Applications, Migration, Tools","Photos, Applications, Migration, Tools，Video，Media"
SnapTweet,Mashup to easily share your Flickr photos on Twitter.,Flickr @@@ Twitter,photo,"Photos, Blogging, Messaging","Photos, Blogging, Messaging，Video，Social"
Pikter,Pikter is a simple service that enables you to share photos on Twitter and-or Jaiku.,Twitter @@@ Jaiku,photo,"Photos, Messaging, Social, Blogging","Photos, Messaging, Social, Blogging"
Photobucket Pics on TiVo,Use TiVo to display your Photobucket photos on your home television.,Photobucket,photo,"Photos, TV, Video","Photos, TV, Video"
Custom Flickr Calendar,"Create an advanced photo calendar with your Flickr photos. It is easy to use, and there are many templates to choose from.",Flickr,photo,"Photos, Calendars, eCommerce","Photos, Calendars, eCommerce，Video"
Life in Grayscale,Presenting vintage photos from Flickr in an interesting way.,Flickr,photo,"Photos, History, Visualizations","Photos, History, Visualizations，Video"
Windows Vista Slideshow Gadget,Create your own slideshow and let it run on your Vista Sidebar. Upload your photos at Imageloop and fetch your permalink.,imageLoop,photo,"Photos, Widgets, Applications","Photos, Widgets, Applications"
MyFlickr,Add photos search from Flickr photos in your website and display them.,Flickr,photo,Photos,Photos，Video
Phreetings,"Phreetings, photo + greetings, is a service for creating photo greeting cards using a drag-and-drop technique. The photos that you drag are Flickr images.",Flickr,photo,"Photos, Games","Photos, Games，Video"
Mosaickr,Allows you to create mosaics of photos from Flickr. Each mosaic is one large image composed of small tile images.,Flickr,photo,"Photos, Humor, Visualizations","Photos, Humor, Visualizations，Video"
Big Huge Labs,Uses Flickr API to do fun stuff with photos. Home of the fd Flickr Toys.,Flickr,photo,"Photos, Humor","Photos, Humor，Video"
Mapanno,Allows users of flickr and 23 photo services to mash up their images into an interactive web page with the option of including Google Maps or Second Life Maps as a background.,Flickr @@@ Google Maps @@@ SecondLife @@@ 23,photo,"Photos, Mapping","Photos, Mapping，Video，Viewer,Games"
Picnik Online Photo Editing,"Quickly edit all your online photos from your browser. Web-based way to fix underexposed photos, remove red-eye, or apply effects to your photos. All online.",Flickr @@@ Google Picasa,photo,"Photos, Editing","Photos, Editing，Video"
Splashr,Choose from over 20 creative styles for presenting your Flickr photos. Interesting variety. Creates clean urls for bookmarking and sharing.,Flickr,photo,Photos,Photos，Video
flillustrator,"Small flash app lets users write short stories, get auto-generated illustrations from Flickr photos, and play around with the results. Nicely done.",Flickr,photo,"Photos, Visualizations","Photos, Visualizations，Video"
ScreenSvr,"ScreenSvr is a simple screen saver for Windows PCs. It grabs photos from Flickr, based on your selection criteria, and displays them in a repeating slideshow as a screensaver.",Flickr,photo,Photos,Photos，Video
Bubblr,Fun flickr mashup that lets you add cartoon bubbles to photos.,Flickr,photo,Photos,Photos，Video
Slideroll,"Create photo slideshows with music. Site allows you to add Flash to flickr, myspace, xanga, and Blogger",Flickr,photo,Photos,Photos，Video
Flickr Album Maker,Use this album maker to build an album and a slideshow of your Flickr photos. It can generate HTML code for you to embed to your blog or web site.,Flickr,photo,Photos,Photos，Video
FxFoto,Windows desktop application for managing photo scrapbooks. With photo service upload capabilities.,Smugmug,photo,Photos,Photos
PictureSync,"Mac desktop application for batch uploading of files to various photo services including Flickr, Smugmug, and Textamerica.",Flickr @@@ Buzznet @@@ Textamerica @@@ Smugmug,photo,Photos,"Photos,Video,Blogging"
StarExplorer,Desktop application for managing photos on the Smugmug service.,Smugmug,photo,Photos,Photos
Instastrm - Live Instagram Photo Stream,Instastrm is a web application where you can stream real-time feeds from Instagram by photo tags. Instastrm will create a real-time photo stream for you and will continuously query Instagram server for latest images that matches the tag you entered or selected.,Instagram @@@ Instagram Real-time,photo,"Photos, Streaming, Real Time","Photos, Streaming, Real Time,Mobile,Mapping,Webhooks"
PelFind,"PelFind lets you explore interesting photos from around the web. You can also enter urls of webpages that you want to explore, create lists and more.",Yahoo Query Language,photo,"Photos, Search, Visualizations","Photos, Search, Visualizations"
Listagram,Listagram is a way to browse the life of your friends through a series of pictures on Instagram. It searches the Instagram user's public photo archive from the URL of one photo and shows like Frickr's photostream.,Instagram,photo,"Photos, Mobile, Search, Social","Photos, Mobile, Search, Social"
Photos of Life,You can browse between living beings kingdoms and see word distributions and photos from Flickr. GBIF (Global Biodiversity Information Facility) provides taxonomy APIs and word distribution maps.,Flickr @@@ Global Biodiversity Information Facility,photo,"Photos, Science, Science","Photos, Science, Science,Video，Reference"
Flickorama: 3D Flickr Photoset Viewer,"Search and view Flickr photoset slideshows in cool 3D layouts: Cover Flow, Carousel, Grid, Spiral, Roller Coaster, and Time Machine. Powered by OpenFlux 3D, aka PlexiGlass. Includes large photo view, full screen mode, thumbnail strip and photo shuffling.",Flickr,photo,"Photos, 3D, Visualizations","Photos, 3D, Visualizations，Video"
Snaplickr,Snaplickr is a Flickr photos tool and social utility. Users can bookmark favorite photos and leave comments for others. Rich Flash based UI.,Flickr,photo,"Photos, Search, Classification, Social","Photos, Search, Classification, Social，Video"
Pixoble,"Unified visual. Type a search term and then gets results of Flickr photos, YouTube videos, Yahoo photos, Yahoo videos, and more.",Flickr @@@ YouTube @@@ Yahoo Video Search @@@ Yahoo Image Search @@@ AOL Video @@@ LiveVideo @@@ Veoh,photo,"Photos, Video, Search","Photos, Video, Search，Media，Social"
Flickr Watch,Watch new photos being uploaded to Flickr in real time. Uses Ajax.,Flickr,photo,Photos,Photos，Video
Nikon Photos,Search and compare Nikon DSLR photos.,Flickr,photo,Photos,Photos，Video
psynchr,psynchr is a Flash based web service to view multiple photosets. You can synchronize multiple photosets on flickr.,Flickr,photo,"Photos, Visualizations","Photos, Visualizations，Video"
Snaparazzi,"Search Photos from over 2,000,000 snaparazzi. Buy and sell photos. Using the Fotolia API.",Fotolia,photo,"Photos, Search, eCommerce","Photos, Search, eCommerce，Images"
Flickr Slide Show,"This shows photos of Flickr in Google Maps API Interface, not on map. You can search by tag, text and username.",Flickr @@@ Google Maps,photo,"Photos, Mapping","Photos, Mapping，Video，Viewer"
dumpr.net,"A collection of stuff to do with Flickr image manipulation, community based photo engine and a system to print photos on shirts, mugs, and stickers.",Flickr @@@ del.icio.us @@@ Cafe Press,photo,"Photos, eCommerce","Photos, eCommerce，Video，Bookmarks，Social,Customization"
WAP Based Image Search,"Search for Photos and Images on Flickr, Yahoo, Riya, Webshots and even News right from a WAP capable phone.",Flickr @@@ 411Sync @@@ Yahoo Image Search @@@ Riya @@@ WebShots,photo,"Photos, Search, Mobile","Photos, Search, Mobile，Video"
mashfot - a mashup about photography,"mashfot is a one-page view about photo. You can find links, news and photos on this site.",Flickr @@@ del.icio.us @@@ 23,photo,"Photos, News Services, Bookmarks","Photos, News Services, Bookmarks，Video,Social"
Flickr Group Browser,Explore the relationship between Flickr groups and photos with this useful groups browser.,Flickr,photo,Photos,Photos，Video
Tiltomo,"Content based visual photo search application for Flickr. Look for an image you like, then Find Similar photos either by subject matter mode or color and texture mode.",Flickr,photo,"Photos, Search","Photos, Search，Video"
Flickrscape,Enter a word and watch the flickr photo stream. Click to interrupt stream and try another word.,Flickr,photo,Photos,Photos，Video
LfVr,"A lightweight Flickr viewer. You can search and browse photos by users, contacts, photosets, tags, or groups. If the photo is geotagged, it can also be mapped.",Flickr,photo,"Photos, Mapping","Photos, Mapping，Video"
FlickrFling,"Innovative prototype for exploring Flickr photos. Point the application at a feed, like CNN, it then renders the news in photos by matching tagged photos to words from the news.",Flickr,photo,"Photos, News Services","Photos, News Services，Video"
flAppr,An nice explorative Flash-based interface into Flickr photos.,Flickr,photo,Photos,Photos，Video
Instagr.in,"Instagr.in is a web-based version of Instagram that supplies to users the complete functionality of Instagram, including browsing user feeds, tagging users & locations, liking/unliking, performing a search of Instagram by keyword or username, commenting, as well as downloading and sharing photos. In addition to these normal functions, a unique aspect of Instagr.in is that the ""blend"" tab will aggregate occurrences of identical of users, hashtags, and locations into a single feed.",Instagram,photo,"Photos, Community, Images","Photos,Community,Images"
GetOutCast,GetOutCast provides users with a customized forecast for the photographic potential for any location in the U.S. GetOutCast uses a mashup of atmospheric and weather data to analyze and get the most probable result. It helps photographers to determine when and where to capture their images.,NOAA National Weather Service (NWS),photo,"Photos, Astronomy, Travel, Weather","Photos,Astronomy,Travel,Weather"
Democrat or Republican,Guess if congress members are democrats or republicans based on photos.,Amazon S3 @@@ Sunlight Labs Congress @@@ AppFog,photo,"Photos, Humor, Games, Government","Photos,Humor,Games,Government"
letsGo.io,This mashup is an app that will help you discover that new adventure or vacation through amazing photography from some of the most amazing photographers in the world.,Bing Maps,photo,"Photos, Mapping, Humor, Visualizations","Photos,Mapping,Humor,Visualizations"
This is Now!,"This is Now project is a visual composition which uses real-time updates from the ever popular Instagram application based on users geo-tag locations. The tool streams photos instantly as soon as they are uploaded on Instagram and captures a city's movement, in a fluid story.",Instagram,photo,"Photos, Mapping, Real Time, Visualizations","Photos,Mapping,Real Time,Visualizations"
Pingram,Pingram allows users to search through Instagram photos using a Pinterest like interface.,Instagram @@@ Pinterest Domain,photo,"Photos, Social, Humor","Photos,Social,Humor"
[t]Space,"TopTechPhoto Space is a Lightroom plugin which allows easy storage for catalogs content onto a network(Dropbox, FTP, sFTP or samba) server, instead of a computer internal HDD, freeing up storage space there. It also enables users to share catalog images with others.",Amazon S3 @@@ Google Storage @@@ Dropbox @@@ MediaFire,photo,"Photos, Storage, Plugins, Social","Photos,Storage,Plugins,Social"
Pic4Pass,Online passport and visa photo service that provides guaranteed government compliance based on sophisticated biometrics.,BioID Web Services,photo,"Photos, Passports, Authentication, Identity, Travel","Photos,Passports,Authentication,Identity,Travel"
Picomp'it,"Picomp'it is a service to create and host a photo contest, set some options, add photos from social networks, share your contest and see vote's results!",Flickr @@@ Facebook @@@ 500px,photo,"Photos, Social","Photos,Social"
Send Photos To India,"YouSendPhotos.com provides online Digital Photo Print Services to Indian community all over the world to share their joys with their family members at cheaper rates. You just need to logon to your Facebook or even you can upload your pictures to yousendphotos.com website and then select your great pictures. Thats it, YouSendPhotos.com pick them from there, print in required format and Send Photo Prints to Your Home In India earlist possible. Yes, now with YouSendPhotos.com you can Send Quality Photos to India very easily from anyware and everywhere with affordable prices.",Facebook,photo,"Photos, Social, Messaging","Photos,Social,Messaging"
Caption.Me,An ongoing caption competition that selects two photos from a group on Flickr every day to receive dozens of funny captions. Also uses D3/node.js and Bing image search to show a collaborative mind map for brainstorming caption ideas.,Flickr @@@ Bing,photo,"Photos, Social, Humor","Photos,Social,Humor"
LOCPix,"LOCPix allows searching and viewing of the digitized photo collections from the Library of Congress. Browse collections or search the vast archive for interesting historical photographs and poster artwork. Hundreds of thousands of images are available, many in high resolution.",Library of Congress Prints & Photographs,photo,"Photos, Search, Images","Photos,Search,Images"
Let's Make a Puzzzzle,"Let's Make a Puzzzzle allows users to upload a photo and turn it into a puzzle. Choose difficulty levels ranging from ""passing time"" to ""nearly impossible"".",Aviary Effects,photo,"Photos, Humor, Games","Photos,Humor,Games"
SlideMyPics,"Free HTML5 slideshows from Facebook, Flickr, Photobucket, Smugmug, Picasa, Youtube (as soundtrack music) and SlideshowBox HTML5 slideshow component.",Flickr @@@ YouTube @@@ Smugmug @@@ Amazon S3 @@@ Facebook @@@ Google Picasa @@@ Photobucket,photo,"Photos, Humor, Social, Video","Photos,Humor,Social,Video"
Printsgram Social Printing,"Printsgram provides printable PDF files from your Instagram photos, with several different layout templates. PDF files are created on standart international paper sizes, so you can print them with your printer or go to a local print store for larger prints.",Instagram,photo,"Photos, Printing, Printing, Social","Photos,Printing,Printing,Social"
Itooner,Itooner is a facebook application where you can draw comic book ballons on top of famous photos.,Amazon S3 @@@ Facebook @@@ Amazon EC2,photo,"Photos, Humor, Humor","Photos,Humor,Humor"
The New Photography,Watch the internet as it's being uploaded. Every 10 seconds it grabs the newest public photo from Flickr.,Flickr,photo,"Photos, Random","Photos,Random"
MeechMe,"Provides a place for any web page for visitors to meet, chat, share their social profiles and photos and videos. There's also a play stock market where users can invest in social profiles and web pages.",Flickr @@@ Google Maps @@@ YouTube @@@ Facebook @@@ Twitter @@@ Digg @@@ Friendster @@@ LinkedIn @@@ Bebo @@@ MySpace @@@ Photobucket @@@ TwitPic @@@ TweetPhoto @@@ foursquare @@@ Yahoo Contacts,photo,"Photos, Video, Games, Chat, Social","Photos,Video,Games,Chat,Social"
44tips - your visual start page,"With 44tips.com you create a startpage with your favorite content. Import your photos, videos, music, bookmarks. View your favorite websites in one place. Discover similar content. Collect, save and share your content.",Flickr @@@ del.icio.us @@@ YouTube @@@ Last.fm @@@ Facebook @@@ Twitter @@@ LinkedIn @@@ Thumbalizr @@@ Hyves,photo,"Photos, Music, Video, Games, Social","Photos,Music,Video,Games,Social"
New York Pictures,"A photo atlas of New York City created by a fusion of semantic web data, flickr photos, and crowdsourcing. Based on semantic GIS technology that can assign accurate geotags based on textual and other metdata.",Flickr,photo,"Photos, New York City, Travel, Mapping","Photos,New York City,Travel,Mapping"
PriceMachine,Pricemachine is an automated price comparison tool. Users can automatically log regularly purchased items from online or loyalty card purchases. PriceMachine can then find the cheapest place to buy the same items. This mashup uses the Information Machine API.,Information Machine,price,"price, Aggregation, Prices","eCommerce, Aggregation, eCommerces，Coupons，Food，Grocery，Health，Loyalty，Platform-as-a-Service，Purchasing，Recommendations，Rewards"
Use That Gift Card,Use That Gift Card is an application that lets users to find products from BestBuy and Walmart based on the amount of funds they have on the gift cards. This mashup uses Walmart Open and Best Buy Products APIs.,Walmart Open @@@ Best Buy Products,price,"price, Gifts","eCommerce, Gifts，Referrals，Search"
